<?xml version="1.0" encoding="UTF-8"?>
<xs:schema xmlns:xs="http://www.w3.org/2001/XMLSchema">
    <xs:element name="dataDocument">
        <xs:complexType>
            <xs:all>
                <xs:element name="a">
                    <xs:complexType>
                        <xs:sequence>
                            <xs:element name="TrdCaptRpt">
                                <xs:complexType>
                                    <xs:sequence>
                                        <xs:element name="RptSide" minOccurs="0" maxOccurs="unbounded">
                                            <xs:complexType>
                                                <xs:sequence>
                                                    <xs:element name="Pty" minOccurs="0" maxOccurs="unbounded">
                                                        <xs:complexType>
                                                            <xs:attribute type="xs:string" name="R" use="optional"/>
                                                        </xs:complexType>
                                                    </xs:element>
                                                    <xs:element name="TrdRegTS" minOccurs="0" maxOccurs="unbounded">
                                                        <xs:complexType>
                                                            <xs:attribute type="xs:string" name="TS" use="optional"/>
                                                            <xs:attribute type="xs:string" name="Typ" use="optional"/>
                                                        </xs:complexType>
                                                    </xs:element>
                                                </xs:sequence>
                                                <xs:attribute type="xs:string" name="ClOrdID"/>
                                            </xs:complexType>
                                        </xs:element>
                                    </xs:sequence>
                                </xs:complexType>
                            </xs:element>
                        </xs:sequence>
                    </xs:complexType>
                </xs:element>
            </xs:all>
        </xs:complexType>
    </xs:element>
</xs:schema>